新闻内容,新闻类别
故宫学院西安分院成立 致力于文博专业人才培养,国内
台湾花莲县海域发生4.0级地震 震源深度12千米,国内
＂网红科学家＂韩春雨科学是一件非常酷的事情,国内
＂草原天路＂今起暂停收费 原通知23日停止收费,国内
工商总局积压商标注册证已经发放完毕,国内
莆田系陈新喜被指有假身份 曾因涉毒被抓(图),国内
郑州拆迁户杀人案凶手对拆迁充满敌意 无安全感,国内
湖南监狱被曝囚犯聚众赌博 多名责任人被处理,国内
山西省公安厅交管局原局长涉受贿罪行贿罪被公诉,国内
湖北一人大常委会副主任车祸身亡 官方系意外,国内
国台办：坚持“九二共识”两岸沟通机制才能延续,国内
海协会两会协商联系机制＂九二共识＂为基础,国内
海淘新政确认松绑一年通关单取消 新税率不变,国内
广西梧州人大原副主任受贿案宣判 被判刑6年,国内
湖南落马官员忏悔曾认为作风不检点是一种时尚,国内
广东汕尾市原公安局长任职3年 卖官受贿200万,国内
媒体盘点变、贪、腐、横集于一身的官员都有谁,国内
江西启动防汛Ⅳ级应急响应 迎来暴雨集中期,国内
发改委东北不搞提前退休 民生拨款向东北倾斜,国内
广西政府采购＂假货＂调查遭质疑 问题设备未送检,国内
人民日报台当局新领导人交了一份未完成答卷,国内
新一轮强降水袭击南方 广东茂名洪水漫堤1人失踪,国内
安徽一环保局长车载女子撞来捉奸妻子 已被停职,国内
足协严惩宏兴8人终身禁足 ＂罚单＂落地问题仍待解,国内
气象台发布暴雨蓝色预警 广东海南等5省大到暴雨,国内
河北吴桥研究公务员周六是否上班 说法2天2变,国内
国家谈判成效显著 乙肝肺癌3种药品降价过半,国内
11省“三项医保”已实现由人社部门统一管理,国内
四川阿坝州理县发生3.7级地震 震源深度11千米,国内
国资委副主任谈央企＂瘦身＂该退的没退出(图),国内
张北＂草原天路＂下周起取消收费 政策持续22天,国内
北京出台新规正局级领导配偶禁经商办企业,国内
首批国家药品价格谈判出结果3种药最高降幅67%,国内
商丘警方破获恶性绑架案 5名犯罪嫌疑人被抓,国内
平遥古城违建突出被文物局约谈 建42米摩天轮,国内
从“草原天路”想起，有哪些政策曾被紧急叫停？,国内
艺术大师捐赠158件藏品失踪 家属发声明追索,国内
研究称喜马拉雅山大地震酝酿成熟 或达8级以上,国内
多省份公布2015年平均工资 看你家乡工资有多高,国内
商事改革怎么推?央企怎么改?总理重点强调这三字,国内
12省输出16万高招指标：因高校多 本省生源不够,国内
李河君宣布辞任汉能薄膜执行董事 即日起生效,国内
＂中原首家五星会所＂被查 消费者不仅很黄还贵,国内
山西深度反腐＂两手抓＂ 300多名空缺干部多数配齐,国内
江西落马局长老板没本事能力 赚钱却远超自己,国内
兰州速录员称单位不签合同不交社保 已申请仲裁,国内
多次成为总书记＂座上宾＂ 这4人有何过人之处,国内
毒地事件再发酵 常隆化工等三家企业被诉,国内
湖南落马官员喜欢跟女人在一起 不检点是时尚,国内
曝辽宁原政法委书记苏宏章用大额黄金制品行贿,国内
香港城市大学天台顶棚倒塌 目前已有3人受伤,国内
雷闯徒步进京推动乙肝药降价要像蚊子 不停发声,国内
国资委：央企纵向横向重组不会出现新的垄断,国内
张家口决定草原天路取消收费为方便游客旅游,国内
国务院决定吴清任上海证券交易所党委书记,国内
天津国际集团公司原党委副书记迟捷被开除党籍,国内
辽宁舰舰长张峥大校已出任海军参谋长助理(图),国内
足协取消武汉宏兴俱乐部注册资格 8人被禁赛,国内
公安部领导班子大调整副部长黄明为正部长级,国内
外交部不论台发生什么变化 中国政府立场不变,国内
中方：将依法处理妄图颠覆中国国家政权组织,国内
河北沧州新能源车补贴资金缺6亿 官方：保证落实,国内
国台办负责人就当前两岸关系发表谈话,国内
中国国民党发布新闻稿 蔡英文避谈九二共识,国内
南洋理工学院女大学生毕业季穿白纱告别校园(图),国内
网传杨绛病危 三联书店前总编辑没有说她病危,国内
检察机关已对125名涉嫌非法经营疫苗犯罪批捕,国内
媒体传杨绛先生病危 家中电话无人接听(图),国内
落马官员情妇经济学官员成为其敛财＂棋子＂(图),国内
德阳原市委常委、副市长杨恩林被逮捕(图),国内
郑州警方夜查红馆异地调警 知情者涉黄＂比较乱＂,国内
陕西4所虚假大学被曝光 校名简介均系仿冒抄袭,国内
四川德阳原副市长杨恩林涉嫌受贿罪被逮捕,国内
湖北高考改革2021年起不分文理科 减少加分项,国内
药价＂腰斩＂ 肺癌乙肝三种药品最高降价67％,国内
香港一超市外发现高射炮弹壳 警方获报调查,国内
上海成立国内首个＂首席科学家办公室＂,国内
南京艺博会搬到酒店开展 可直接私洽大师作品,国内
河南焦作2名官员因涉嫌严重违纪接受组织调查,国内
世博气球变身雾霾＂哨兵＂ 华理奉贤校区建成观测 ,国内
国家药品价格谈判 乙肝药品降价,国内
北京北五环运巨型佛像大车侧翻 砸扁路过车致拥 ,国内
王小洪履新公安部副部长 3年里4次职务调整(图),国内
多景区推＂中国旅游日＂半价优惠 游客却不感冒,国内
西双版纳放生野生动物 蜂猴钳嘴鹳结伴“回家”,国内
承诺30天无忧退货  网易严选打造极致购物体验,国内
云南副教授被指与女生关系暧昧 校方对其停职调 ,国内
郑州至欧洲班列往返开行平衡 每周进出境各三班,国内
暨大师生因电话诈骗4个月失65万 买试题被骗5万,国内
河南人大代表＂冒领百万补偿款＂事件举报人遭威胁,国内
全国首个机器人学院在京成立 今年首次招生100人,国内
税务智能“机器人”与纳税人互动 近14万条问答,国内
国务院：王小洪任公安部副部长 张涛任央行副行 ,国内
合肥房价飙涨乱象326名卖房者反悔 乐当被告,国内
全球首台人机协作双臂机器人首秀武汉（图）,国内
武汉＂自学直考＂第一本驾照出炉 花费不足2000,国内
长江中游发现史前遗址 距今约8000年,国内
贪官敛财五大奇葩理由：贪4744万只为静静欣赏,国内
网曝云南某副教授与女学生暧昧 学校已停职调查,国内
故宫六殿＂掌灯＂点亮紫禁城 启动室内灯光照明,国内
快递小哥坚持验货拦下300公斤冰毒 警方奖励10万,国内
亏损公司撞名《欢乐颂》剧内公司 股价连涨三天,国内
二线城市房价涨幅扩大 地方酝酿新一轮降温调控,国内
媒体：别让彩礼致贫遮蔽年轻人的诗和远方,国内
传销人员饿得没法过了 “请”警察“帮忙”,国内
中国护士数量缺口达几百万 薪酬低导致留不住人,国内
广东允许快递专用电动车上路 允许临时停靠作业,国内
