新闻内容,新闻类别
香港中联办就涉港国安立法征集意见 已收意见130份,国内
教育部挂牌督办广西梧州小学持刀伤人事件 ,国内
老师隔空为3千名毕业生打包行李 学生初恋照片曝光,国内
美国明州州长：参加抗议的人都应接受新冠病毒检测,国内
学者美国正给中国带来双重风险 该对跨境资本收税,国内
又挑衅？美国军舰再次通过台湾海峡，台媒：系今年第七次,国内
国家卫健委：本土现有确诊病例降至10例以下,国内
政、商、黑三界通吃！“教父”级黑老大穿防护装备受审,国内
九成国内航班恢复 上海虹桥机场数据环比增长超50%,国内
沈阳苏家屯区疫情防控风险下调 降为低风险地区,国内
美将把央视等中国媒体列为＂外国使团＂?外交部回应,国内
港区《国歌条例》将于6月12日刊宪、正式实施,国内
《国歌条例草案》审议期间反对派议员泼恶臭液体,国内
网信管理体系延伸至村镇：河北一地挂牌2430个,国内
英首相称扩大对港签证范围 梁振英都去美国 谁找你,国内
北京摆摊地点出炉、夜市重开？官方：未收到通知,国内
英国考虑摆脱对华为5G依赖?中方望给予非歧视环境,国内
民航局：6月8日起 平均每日入境人数约4700人,国内
香港特区立法会三读通过《国歌条例草案》,国内
猪肉价格14周连跌 每公斤零售均价比最高点降13元,国内
外交部：敦促个别国家摘掉有色眼镜 不插手香港事务,国内
中国篮协：CBA将于6月20日复赛 分广东山东2个赛区,国内
美国暂停所有中国客运航班 外交部双方正严正交涉,国内
美国威胁取消香港单独关税区地位 商务部发声,国内
胡锡进美方道德高地基本倒了 只剩用硬实力压我们,国内
体育总局为中超、CBA复赛定规矩 马拉松暂不恢复,国内
“说中医不好就要被抓？”官方回应：这是误读,国内
中国民航局发布新规 专家复飞条件给美方说清楚了,国内
北京购车摇号新政征求意见 官方十问十答,国内
当街刺死女律师案凶手二审死刑 100秒回顾案件始末,国内
王石 ：我不相信马云对财富不在乎，我很在乎,国内
特朗普年度体检报告出炉：服用羟氯喹后没有副作用,国内
亚洲大学排名出炉清华榜首 5所香港高校排名下跌,国内
黄之锋想让欧洲国家反对＂港区国安法＂ 议员卖国,国内
不具有悔过表现，市委原常委舅父的减刑申请被驳回,国内
昨天上海无新增本地病例 无新增境外输入病例,国内
世卫组织：中国以外新冠确诊病例达6203169例 ,国内
牺牲援鄂护士梁小霞母亲：想到我死为止,国内
从浙大副校长到＂阶下囚＂：褚健的＂过山车＂人生,国内
香港特区财政司司长：香港背靠国家 无惧美国制裁,国内
中央港澳工作领导小组首次亮相中南海 韩正任组长,国内
劳动课成高中必修课！教育部公布最新高中课程方案,国内
疫情之下疯抢地王 该推出房地产税吗？,国内
美媒称世卫曾对中国抗疫透明度不满 外交部回应,国内
林郑月娥回应外国＂制裁恐吓＂看不到如何影响香港,国内
副市长转岗政协副主席8天后被查 其前同事也已落马,国内
林郑月娥＂港区国安法＂立法 中央将听取香港意见,国内
甘肃兰州市政协、人大两退休干部同日被查,国内
地摊经济彻底火了！五菱推出“摆摊神车” 上市公司忙坏了：照明灯、折叠棚、场地你们要不要？,国内
台欲购美制反舰导弹 美专家疑惑为何非要改美国货?,国内
钟南山：中国没有瞒报疫情，我们用事实说话！,国内
教育局与钟美美接触：希望引导孩子拍正能量作品,国内
中央统战部九局原局长刘玉江履新河南省副省长,国内
50万“活死人”托养困境：无处安放的生命,国内
四川乐山女子夜跑遇害案发回重审 凶手称遭威胁逼供,国内
中国云铜号称捐五百吨黄金 相当于央行黄金储备1/4,国内
辽宁海事局6月5日-10日将在渤海海峡进行实弹射击,国内
你吃的是几星级的粉？桂林市米粉店要评星级了,国内
新冠无症状感染孕妇康复后顺利产子 婴儿自带抗体,国内
郑州800元摊位被炒至3000元 不少市民开车“练摊”,国内
多国政府：涉港国安立法是中国内政 别国无权干涉,国内
青岛一学院学生每日扫厕所7次 校方培养吃苦耐劳,国内
印度新冠肺炎病例逾20.7万 成第7个确诊超20万国家,国内
男孩模仿老师走红被约谈?教育局家长小孩自行删除,国内
“铜娃娃”得的是什么病：易被误诊的遗传性罕见病,国内
缓刑罪犯违法减刑 南京检察机关两次驳回法院裁定,国内
江西警方百万悬赏通缉3涉黑人员 一头目当过村支书,国内
31省区市新增1例境外输入病例 新增无症状感染者4例,国内
林郑月娥中央出手是给香港生机 不怕美国威胁制裁,国内
重庆无新增本地病例 新增无症状感染者1例,国内
福建女大学生遭前男友裸照威胁自杀 男子被公诉,国内
蔡英文对美国骚乱沉默 国民党高官怎么有脸说港警,国内
李少敏被查 曾与河南两名被查的省部级共事过,国内
姑娘分手后被追讨86万 前男友回应：当时爱得糊涂,国内
英7名前大臣呼吁首相向G7峰会提涉港问题 中方回应,国内
＂签证禁令＂下的中国赴美留学生：忧心学术努力付之东流担心随时被驱逐,国内
倒卖茅台的厅官，还收受侄子贿赂 ,国内
3人同时新晋市委常委 ,国内
博士后正厅，任三亚市委副书记 ,国内
市委书记亲侄子，利用影响力贪了三千多万 ,国内
香港内地、澳门及台湾抵港人士检疫14天措施延长,国内
听起来像吹牛？董明珠格力平均每天有四五十项专利,国内
新疆被查女副主席前一天登党报要闻版 曾参与巡视,国内
新疆女副主席任华被查，前一天登党报要闻版，曾参与中央巡视,国内
新晋中将跨战区履新 曾任王牌部队＂铁军＂参谋长,国内
美计划秘密出售驻港总领馆馆员公寓？外交部回应,国内
执善行远丨知名执行专家谈王思聪失信风波：体现了法律适用普遍性,国内
无需“证明我妈是我妈”！央行取消11项证明事项,国内
专科生参军退役并完成学业后 将可免试入读本科,国内
女县委书记拟升副厅 曾被诬告收上千万 诬告者自首,国内
武汉副市长：武汉核酸检测支出约9亿元由政府承担,国内
李兰娟院士：武汉市是安全的 武汉人是健康的,国内
四川宜宾市珙县发生3.3级地震 震源深度13千米,国内
专家武汉集中核酸检测检出的无症状感染者无传染性,国内
武汉核酸检测复核35961份 未发现结果不一致现象,国内
陕西这些人拟享受政府特殊津贴 演员张嘉译在列 ,国内
武汉集中核酸检测排查 10天政府承担总投入9亿元,国内
蓬佩奥称中国非法获取美技术 赵立坚：开历史倒车,国内
蓬佩奥声称欢迎香港人民到美国避难 外交部回应,国内
云南一正厅级官员自首 系当地1年内第2个被查正厅级,国内
内蒙古公安厅一副厅长被公诉 自2002年后＂步步贪＂,国内
罕见病“铜娃娃”救命药停产告急 厂家：原料断供了,国内
事关“涉港国安法”，林郑月娥明天进京 ,国内
新城控股原董事长王振华＂全国劳动模范＂称号被撤销,国内
“黑脸医生”胡卫锋离世 二孩去年刚刚出生,国内
遗忘28年房子现住户搬家 原房主收房若受阻将报警,国内
美国芝加哥发生骚乱 4人中枪2人死亡60余人被捕,国内
一夜之间涨价700万 北京学区房迎来＂最后的疯狂＂？,国内
北京实施文明行为促进条例 公共交通抢座最高罚500,国内
代理律师：江歌妈妈为人朴实 为刘鑫行为感到心寒,国内
90后女研究生蹦床摔伤致瘫痪 经治疗四肢已有知觉,国内
上海昨日无新增本地病例 新增境外输入1例,国内
黑龙江1日无新增确诊病例 新增无症状感染者2例,国内
新疆维吾尔自治区副主席被查 今年5名中管干部落马,国内
张家界前董事长蹊跷坠亡1个月后 现任董事被查,国内
重庆＂球书记＂被再通报 被指当地政治＂最大污染源＂,国内
两名＂红通人员＂落网并被遣返 曾趁疫情流窜多国,国内
新疆维吾尔自治区政府副主席任华被查 ,国内
武汉一线医务人员子女中考优录材料今日开始报送,国内
李克强称赞地摊经济：是人间的烟火，是中国的生机,国内
特朗普称美将终止与世卫关系 中方美方＂退群＂成瘾,国内
特朗普宣布将取消香港特殊待遇 外交部：损人害己,国内
黑龙江电工持枪杀人 改名潜逃24年被抓获,国内
中国足球这个行业是＂世界冠军＂ 现在外贸订单暴跌,国内
人民日报：乞求外国、勾连“台独”…这是绝路！,国内
黑龙江4岁被虐女童已苏醒：命保住了，还要再手术,国内
山西芮城副县长被刺刑释人员转嫁私愤行凶已被抓,国内
广州：因见义勇为丧失劳动能力奖40万元至100万元,国内
杭州现绿色特殊停车位 限时二十分钟获点赞 ,国内
广东清远一公交站钢棚被大风刮倒 78岁老人身亡,国内
中国将在7至8月执行首次火星探测任务,国内
女子分饰六角骗“网恋男友”30万给丈夫投资养猪,国内
抖音快手直播刷量起底：25元100人气，58元1万粉丝,国内
2020年5月31日湖北省新冠肺炎疫情情况  ,国内
湖北无新增确诊病例 现有确诊病例3例均在武汉市,国内
快讯！美国一半拖挂车冲撞抗议人士 受伤情况不详,国内
郭天南团队：新冠重症患者血清存在独特分子变化,国内
上海昨日无新增本地病例 无新增境外输入性病例 ,国内
内蒙古新增境外输入确诊病例3例 治愈出院1例,国内
专家：美国向中国“索赔”违反多项国际法基本原则,国内
武汉首次无症状感染者新增为零 当日已检测6万余人,国内
3人开车上钙化滩漂移 专家1年形成几毫米 不可逆,国内
美国宣布退出世卫组织后，台湾尴尬了……,国内
统计局回应1300万亿社会总资产：不等于家庭总财富,国内
林郑月娥：涉港国安立法事关重大 势在必行,国内
企业送一箱海鲜打开却是现金 这位厅官受贿获刑7年,国内
招式凌厉!驻港部队组织搏击训练 提升快速制敌能力,国内
检察长任上被查后 官方公开征集其违法犯罪线索,国内
梁振英：对比美国暴乱，还相信香港暴乱没推手吗？ ,国内
中国海军在西沙海滩成功种菜 半亩地收1500多斤,国内
大四学生返校发现衣柜藏蜂窝 赶走蜜蜂吃蜂蜜真甜,国内
刚刚全文披露的重磅报告，在涉港问题上新增了10个字,国内
一箭双星！高分九号02星、和德四号卫星发射成功,国内
秋冬是否会出现第二波疫情？张文宏回应,国内
全国人民代表大会常务委员会工作报告,国内
崔天凯在美媒发文：立法将保障＂一国两制＂行稳致远,国内
李兰娟、张伯礼等28人，享受省部级表彰奖励获得者待遇,国内
SpaceX发射成功创历史 中国商业航天还有多远?,国内
湖南株洲纪委：征集天元区检察长刘仕明犯罪线索,国内
31省区市新增境外输入病例2例 无症状感染者3例,国内
安徽一32岁副县长跨三省学习工作 官方正调查核实,国内
宁波象山海域货船进水坐沉 13名船员获救1人失踪,国内
安徽一区政府因棚改项目停滞 拖欠企业近4.5亿元,国内
一夜跳涨700万 北京两栋楼业主因入学通告紧急调价,国内
陕西宁陕多名学生不明原因咳嗽发烧？检测结果公布,国内
内蒙古大兴安岭森林火灾已扑灭 50人正清理看守  ,国内
离职后还受贿近200万 这名市委原副书记被判刑,国内
特朗普称香港现时是＂一国一制＂ 港府痛斥完全错误,国内
全国两会后首位跨省履新的副部级 从福建调任上海,国内
干扰省委巡视组，她被免职,国内
福建省委常委、纪委书记刘学新 调任上海纪委书记,国内
港媒曝美国总领事馆正出售宿舍洋房 估值百亿港元,国内
刘学新任上海市委常委、市纪委书记 ,国内
港区国安法有违治港方针？林郑引述邓小平讲话反驳,国内
香港律政司司长：香港变成＂一国一制＂说法非常错误,国内
山西教育厅彻查仝卓高考舞弊案 发现问题严肃追责,国内
国务院速下军令状：必须不折不扣落实到位，说到坚决做到,国内
香港一社交平台现＂杀警攻略＂ 一名群组管理员被捕,国内
李文亮之妻驳斥美议员提议不允许借他名义伤害中国,国内
中国安排部分在美国留学人员搭乘临时航班回国,国内
两会闭幕后 为何这几位省级党委书记还未离京？,国内
国台办台立法机构插手干预香港事务必将自食恶果 ,国内
中央军委联参部参谋长：解决台湾问题不排除动武,国内
党媒香港是中国的香港 没人比中央政府更珍爱香港,国内
中印近期再次发生边境对峙？国防部回应 ,国内
香港财政司已为美制裁作足准备 守住金融安全大门,国内
国防部发言人介绍国防经费用途 相比去年有新用途,国内
九战九捷！长征十一号火箭下半年将在海陆多次发射,国内
连花清瘟极简史钟南山为什么推荐 判断逻辑是什么,国内
马云出席毕业典礼：这时找工作 大家会觉得很不幸,国内
中国新技术试验卫星G星、H星发射成功 进入预定轨道,国内
国务院：取消非防疫需要的管制措施 推进改革开放,国内
侠客岛：美国说＂港版国安法＂危害自治 真这么好心?,国内
黄奇帆警告：外企若撤出中国 等于丢弃70%市场份额,国内
美国国内的骚乱，开始让乱港势力出现微妙的分化…..,国内
媒体：英国威胁要接收乱港分子？口惠而实不至,国内
《政府工作报告》全文公布赤字率拟按3.6%以上安排,国内
国务院下军令状该拨的钱尽快下拨，避免中间截留,国内
小型微利企业和个体工商户延缓缴纳2020年所得税,国内
李克强主持召开国务院常务会议 确定重点任务分工,国内
香港逾200万市民“撑国安立法”支持全国人大决定,国内
姚明：不能刻意培养体育竞技人才 先让孩子参与体育,国内
教育部表示对仝某身份事件坚决追查到底,国内
歌手仝卓自称改身份参加高考 教育部追查到底,国内
江苏12岁少女遭继父性侵4年 继父被判有期徒刑15年,国内
涉黑恶案件增量走高 最高法不为求＂战果＂人为拔高,国内
湖北尚不利于推动省外境外来鄂旅游 力推省内游,国内
云南突发岩体崩塌致2人受伤2人被困 被困者已被救出,国内
罕见座谈!政治局常委警告＂台独＂ 军委副主席也在场,国内
美起诉朝鲜银行 赵立坚：手别伸太长 小心被斩断,国内
全国多地取缔露天烧烤对空气造成污染且扰民,国内
工信部2017年6月底前全部电话用户实名登记,国内
＂中财聚赢＂公司称现金紧张无法兑付 已欠房租,国内
语文出版社语文教材未撤掉南京大屠杀题材课文,国内
天津市纪委落马官员张洪宝人称＂宝爷＂,国内
盘点＂宠媳妇＂落马官员苏荣家成了＂权钱交易所＂,国内
人社部将扩大全民参保试点 纳入天津等27地,国内
班禅回藏3拨人迎接 机场欢迎仪式规格高(图),国内
浙江人大常委会拟出台临时规定保障G20峰会,国内
上海青浦区一家蜡业公司发生爆炸 已造成2人死亡,国内
台湾新任“防长”：没听蔡英文说过“台湾独立”,国内
外交部副部长谈南海中国不会成为另一个苏联,国内
江苏检察官顶着举报正常升职 官方未发现其失职,国内
人权组织批中国对西藏实施压制政策 外交部回应,国内
大连3小学生补课遭火灾遇难：4名事故责任人被控,国内
揭秘部分基层政府＂僵尸网站＂日访问量仅个位数,国内
云南公开招聘11名聘任制公务员 最高年薪42万元,国内
交警大队副大队长被送违纪＂喜报＂ 纪委介入调查,国内
陕西汉中出现罕见＂日晕＂景象 光环笼罩太阳四周,国内
王健林回应西班牙大厦事件拆迁是世界难题,国内
台媒韩国推出新雪糕 含药草萃取物可解宿醉,国内
大批旅客滞留深圳福田口岸 传有人打伤警察,国内
百度贴吧全面清查盗版 关闭数千个文学类目贴吧,国内
河北确诊1例人感染H7N9病毒病例 患者病情较重,国内
四川凉山州木里县发生3.4级地震 震源深度12千米,国内
四川凉山州木里县附近发生3.6级左右地震,国内
武汉5万只萤火虫将点亮华中首家夜间动物园(图),国内
泰安调生育保险待遇 女职工生育津贴按158天计算,国内
男子17岁被控杀人 17年后重审怕父母重判未上诉,国内
警方撤销湖南＂被服刑＂农民陈俊杰＂犯罪记录＂,国内
昌平路口车祸致1死1伤 假出租车司机已自首,国内
重庆5人因食品安全责任落实不到位被追责,国内
湖南祁阳县政法委书记从宾馆坠楼 暂无生命危险,国内
台湾新当局首个政治决策对＂太阳花学运＂人士撤 ,国内
台媒大陆滥用抗生素 恐将致每年百万人早死,国内
台湾新当局宣布对126名＂太阳花学运＂人士撤告,国内
中国品牌匹克体育今早停牌 或涉及私有化计划,国内
中国自然保护区面积达国土14.83% 超世界水平,国内
港媒关注＂华为跑了＂刷爆朋友圈＂人为制造撕裂＂,国内
公司为法人代表借贷担保 被转让仍承担连带责任,国内
委国政局动荡后的媒体战政府对抗私媒、外媒,国内
中国网络消费成经济＂压舱石＂城会玩 村爱买,国内
马英九卸任居＂陋室＂ 与台历任＂总统＂豪宅成对比,国内
内蒙古大部气温回升 草原鼠害面积达到5876万亩,国内
刘江兼任任西藏自治区党委政法委副书记,国内
张茂于任国家知识产权局副局长和党组成员,国内
天津贪官＂宝爷＂被查 与妻上演贪腐夫妻档,国内
上海严重车祸导致中环通行中断 恢复通行要两周,国内
人民日报＂居者有其屋＂并不等于＂居者有产权＂,国内
广西4名蒙面男子全副武装进村 开枪扫射村民(图),国内
美媒中国尝试谈判降低＂救命药＂价格 最高降67%,国内
云南二级公路山体落石砸中微型小客车致1死6伤,国内
甘肃省2人入选“CCTV年度慈善人物”全国百强,国内
武汉首个公益洗衣服务平台启动 免费洗捐赠衣物,国内
天津东丽原副区长张洪宝违纪 上演贪腐＂夫妻档＂,国内
海洋科考36载 ＂科学一号＂青岛退役(图),国内
官媒刊文谈规范警务执法权运行香港起示范作用,国内
江苏人网购爱首饰化妆品 网络消费5年涨12倍,国内
有干部知道要被开除党籍 主动交最后一个月党费,国内
“清贫贪官”田振玉非典型性受贿职权入股获利,国内
煤炭业最严去产能政策持续发酵 煤价有望上涨,国内
河豚被禁26年有望回归餐桌 保障安全是前提,国内
天津通报一起严重扭曲＂亲＂＂清＂政商关系典型,国内
学霸称考试简单不公平应让不努力的人＂疼一疼＂,国内
＂蛟龙＂号结束雅浦海沟科学应用下潜 最深6579米,国内
今年高校毕业生人数达756万 期望月薪多低于5千,国内
农村隐性辍学教育处罚被抵触 教师被迫无视违纪,国内
武汉涉案金额最大＂反宣币＂案宣判 主犯获刑5年,国内
人民日报仍有地方领导＂防火防盗防记者＂,国内
中纪委查处违反八项规定案例 滥发福利居首,国内
全国6600万户承包土地农民已流转三分之一土地,国内
台军考虑征＂周末战士＂＂平日上班 周末入营＂,国内
京沪高铁夜班车出行当晚即达 开通一周趟趟爆满,国内
强降雨轮番侵袭南方省份 多地启动救灾应急响应,国内
新疆阿图什市发生3.0级地震 震源深度7千米,国内
原师级干部举报国企高管购41套房 实为折抵债务,国内
王健林首度回应西班牙大厦事件拆迁是世界难题,国内
王健林有万达 上海迪士尼20年内无法盈利,国内
揭秘地下微整形药品不知真假 无行医资质就上手,国内
检察机关介入湖南雁北监狱囚犯聚众赌博事件调查,国内
山西大同绑架枪案嫌疑人作案动机是图财(图),国内
媒体盘点薄熙来案发后 薄瓜瓜的7次发声与亮相,国内
水客勾结机场内鬼走私香烟 涉案人员达20名,国内
学者调研男子监狱17%服刑人员曾是留守儿童,国内
辽宁朝阳县相继发生4.6级和4.3级两次地震,国内
四千斤“天下第一太极豆腐”2小时内被抢光(图),国内
辽宁省朝阳市发生4.3级地震 震源深度6千米,国内
党报有党员把自己当作纯粹的网民 热衷传播谣言,国内
山东环保违规项目整改不到位 年底一律关停(图),国内
刘少奇之子刘源向家乡捐赠父亲题词墨迹(图),国内
西藏自治区副主席刘江兼任区党委政法委副书记,国内
400所野鸡大学骗术揭秘标注地址根本不存在,国内
黑龙江特大毒杀候鸟案又抓1名嫌犯追回千枚鸟蛋,国内
江苏检察机关介入监督“交警失联死亡”案,国内
网曝北京门头沟一轿车跌落悬崖 正待救援,国内
纪检干部自述当街遇被查官员遭其挥拳恐吓,国内
湖北钟祥一命案逃犯潜逃23年后投案自首,国内
网络平台曝中国第5批虚假大学 专家建议司法监管,国内
武警甘肃总队原司令邢伟志辞去甘肃人大代表职务,国内
武汉一区政府1400万设备卖70万 称1400万是估价,国内
新疆哈密北部突然降温降雪 天山银装素裹,国内
长江无鱼则成自来水管 中华鲟救助联盟在沪成立,国内
湖南城市学生也可享免费教科书 2016年秋季实行,国内
台湾屏东县发生4.2级地震 震源深度5千米(图),国内
习近平从严治党明规则换潜规则青年党员有干劲,国内
西藏日喀则半日内发生4次地震 最大震级5.3级,国内
西藏日喀则市发生4.1级地震 震源深度6千米,国内
人民日报街区制主要在新小区推 核心非围墙开放,国内
西南地区有较强降雨 北方部分地区有中到大雨,国内
BBC称中国机场准点率全球垫底但迟早比肩西方,国内
浙大120周年校庆公告全篇文言文四教授合力创作,国内
武钢被传闻将与宝钢重组＂中国东钢＂ 武钢否认,国内
四川出台意见贫困村第一书记不得随意撤换调离,国内
台媒剖析新领导人两岸论述技巧性回避九二共识,国内
党报批局地政府办事拖延推诿：别拿走程序当借口,国内
女乘客晕倒机舱 中美医生万米高空上演生死救援,国内
台湾高雄市附近发生4.4级地震 震源深度27千米,国内
浙江全省开展塑胶跑道全面检查 空置期后再使用,国内
村民对村支书不满＂毁其政绩＂破坏600棵树,国内
广东信宜成“雨窝” 6小时雨量达429.5毫米(图),国内
媒体：李小平你怎么总落马 刘德华躺枪,国内
网络消费大数据揭剁手党真面目男人更＂败家＂,国内
媒体曝光北京体检行业乱象：最贵套餐近4万元,国内
广东茂名暴雨致8死4失踪 23个镇55万多人受灾,国内
重庆新规4月1日后结婚的夫妇可休15天婚假,国内
假律师骗老乡近27万 转头被合伙人骗走20余万,国内
温州一小学被曝＂毒跑道＂  学生停课将搬离校区,国内
广东信宜遭超200年一遇暴雨袭击 已致8人死亡,国内
国家质检总局激光笔可对儿童眼睛造成永久伤害,国内
杨绛保姆先生因年纪大了目前在医院调养,国内
港媒内地抢房潮或套牢炒房者 变＂富翁＂无望,国内
媒体盘点烟草系统落马的官员 湖南一年被查14人,国内
云南警方缴获毒品30000克 抓获3名嫌疑人,国内
太原将建成国内首个纯电动出租车城市 车价30万,国内
＂全家腐＂官员王敏妻子被请豪赌 张全儿子收百万,国内
金一南曾向两任总书记建言 ＂红二代＂少将啥来头,国内
马英九卸任第一天 晨跑3公里做80个俯卧撑(图),国内
外媒探访中国体校生源减少 训练让位文化学习,国内
京藏高速青海民和境内连发2起交通事故 4人遇难,国内
薄瓜瓜哥大法学院博士毕业 曾称不想当官经商,国内
国家防总对西南地区等地强降雨防范工作进行部署,国内
东海舰队原副参谋长王建勋履新上海水警区司令员,国内
汉能高层大换血 发声明称＂不要过度解读＂,国内
清华招办主任招生不是看分掐尖 要回归教育本质,国内
郑州一服装厂连续爆炸 多人被困已致6死7伤(图),国内
四川德阳原市委常委副市长杨恩林涉嫌受贿被逮捕,国内
广东强暴雨致重灾区信宜8人死亡4人失踪,国内
常州中院受理常外土地污染公益诉讼,国内
